{
  "case_type": "cantilever_tip_load",
  "backend": {
    "name": "OpenSees"
  },
  "beam": {
    "length": 6.13,
    "num_elements": 12
  },
  "section": {
    "A": 0.000764,
    "Iz": 8.489e-08
  },
  "material": {
    "E": 25000000000.0
  },
  "load": {
    "type": "point_force",
    "magnitude": 1350.0,
    "direction": "y_negative",
    "x": 6.130000000000001
  },
  "supports": [
    {
      "name": "A",
      "type": "fixed",
      "x": 0.0,
      "reactions": {
        "Rx": 0.0,
        "Ry": 1349.9999999999995,
        "Mz": 8275.5
      }
    }
  ],
  "extrema": {
    "axial_force": {
      "value": 0.0,
      "x": 0.0
    },
    "shear_force": {
      "value": 1350.0,
      "x": 0.0
    },
    "bending_moment": {
      "value": 8275.5,
      "x": 0.0
    },
    "displacement_y": {
      "value": -48.842399999999984,
      "x": 6.13
    },
    "rotation_z": {
      "value": -11.9517,
      "x": 6.13
    }
  },
  "response_points": [
    {
      "label": "load_point",
      "x": 6.130000000000001,
      "N": 0.0,
      "V": 1350.0,
      "M": -1.1812062439275905e-10,
      "uy": -48.8424,
      "rz": -11.9517
    }
  ],
  "stations": [
    {
      "x": 0.0,
      "N": 0.0,
      "V": 1350.0,
      "M": 8275.5,
      "uy": 0.0,
      "rz": 0.0
    },
    {
      "x": 0.03065,
      "N": 0.0,
      "V": 1350.0,
      "M": 8234.1228,
      "uy": -0.02967858,
      "rz": -0.11453699999999999
    },
    {
      "x": 0.0613,
      "N": 0.0,
      "V": 1350.0,
      "M": 8192.7456,
      "uy": -0.05935716,
      "rz": -0.22907399999999997
    },
    {
      "x": 0.09195,
      "N": 0.0,
      "V": 1350.0,
      "M": 8151.3684,
      "uy": -0.08903574,
      "rz": -0.343611
    },
    {
      "x": 0.1226,
      "N": 0.0,
      "V": 1350.0,
      "M": 8109.9912,
      "uy": -0.11871432,
      "rz": -0.45814799999999994
    },
    {
      "x": 0.15325,
      "N": 0.0,
      "V": 1350.0,
      "M": 8068.614,
      "uy": -0.1483929,
      "rz": -0.572685
    },
    {
      "x": 0.1839,
      "N": 0.0,
      "V": 1350.0,
      "M": 8027.2368,
      "uy": -0.17807148,
      "rz": -0.687222
    },
    {
      "x": 0.21455,
      "N": 0.0,
      "V": 1350.0,
      "M": 7985.8596,
      "uy": -0.20775006,
      "rz": -0.8017589999999999
    },
    {
      "x": 0.2452,
      "N": 0.0,
      "V": 1350.0,
      "M": 7944.4824,
      "uy": -0.23742864,
      "rz": -0.9162959999999999
    },
    {
      "x": 0.27585,
      "N": 0.0,
      "V": 1350.0,
      "M": 7903.1052,
      "uy": -0.26710722,
      "rz": -1.0308329999999999
    },
    {
      "x": 0.3065,
      "N": 0.0,
      "V": 1350.0,
      "M": 7861.728,
      "uy": -0.2967858,
      "rz": -1.14537
    },
    {
      "x": 0.33714999999999995,
      "N": 0.0,
      "V": 1350.0,
      "M": 7820.3508,
      "uy": -0.32646437999999994,
      "rz": -1.2599069999999999
    },
    {
      "x": 0.3678,
      "N": 0.0,
      "V": 1350.0,
      "M": 7778.9736,
      "uy": -0.35614296,
      "rz": -1.374444
    },
    {
      "x": 0.39844999999999997,
      "N": 0.0,
      "V": 1350.0,
      "M": 7737.5964,
      "uy": -0.38582153999999996,
      "rz": -1.4889809999999999
    },
    {
      "x": 0.4291,
      "N": 0.0,
      "V": 1350.0,
      "M": 7696.2192000000005,
      "uy": -0.41550012,
      "rz": -1.6035179999999998
    },
    {
      "x": 0.45975,
      "N": 0.0,
      "V": 1350.0,
      "M": 7654.842000000001,
      "uy": -0.4451787,
      "rz": -1.7180549999999997
    },
    {
      "x": 0.4904,
      "N": 0.0,
      "V": 1350.0,
      "M": 7613.4648,
      "uy": -0.47485728,
      "rz": -1.8325919999999998
    },
    {
      "x": 0.52105,
      "N": 0.0,
      "V": 1350.0,
      "M": 7572.0874,
      "uy": -0.52319094,
      "rz": -1.943809
    },
    {
      "x": 0.5517,
      "N": 0.0,
      "V": 1350.0,
      "M": 7530.7096,
      "uy": -0.6088347599999998,
      "rz": -2.048386
    },
    {
      "x": 0.58235,
      "N": 0.0,
      "V": 1350.0,
      "M": 7489.3318,
      "uy": -0.69447858,
      "rz": -2.1529629999999997
    },
    {
      "x": 0.613,
      "N": 0.0,
      "V": 1350.0,
      "M": 7447.954,
      "uy": -0.7801223999999999,
      "rz": -2.2575399999999997
    },
    {
      "x": 0.6436499999999999,
      "N": 0.0,
      "V": 1350.0,
      "M": 7406.5762,
      "uy": -0.8657662199999998,
      "rz": -2.3621169999999996
    },
    {
      "x": 0.6742999999999999,
      "N": 0.0,
      "V": 1350.0,
      "M": 7365.1984,
      "uy": -0.9514100399999996,
      "rz": -2.4666939999999995
    },
    {
      "x": 0.7049500000000001,
      "N": 0.0,
      "V": 1350.0,
      "M": 7323.8206,
      "uy": -1.03705386,
      "rz": -2.5712710000000003
    },
    {
      "x": 0.7356,
      "N": 0.0,
      "V": 1350.0,
      "M": 7282.4428,
      "uy": -1.12269768,
      "rz": -2.675848
    },
    {
      "x": 0.76625,
      "N": 0.0,
      "V": 1350.0,
      "M": 7241.0650000000005,
      "uy": -1.2083415,
      "rz": -2.7804249999999997
    },
    {
      "x": 0.7968999999999999,
      "N": 0.0,
      "V": 1350.0,
      "M": 7199.6872,
      "uy": -1.2939853199999998,
      "rz": -2.8850019999999996
    },
    {
      "x": 0.82755,
      "N": 0.0,
      "V": 1350.0,
      "M": 7158.3094,
      "uy": -1.3796291399999998,
      "rz": -2.989579
    },
    {
      "x": 0.8582,
      "N": 0.0,
      "V": 1350.0,
      "M": 7116.9316,
      "uy": -1.4652729599999998,
      "rz": -3.094156
    },
    {
      "x": 0.88885,
      "N": 0.0,
      "V": 1350.0,
      "M": 7075.5538,
      "uy": -1.5509167799999999,
      "rz": -3.198733
    },
    {
      "x": 0.9195,
      "N": 0.0,
      "V": 1350.0,
      "M": 7034.176,
      "uy": -1.6365605999999997,
      "rz": -3.3033099999999997
    },
    {
      "x": 0.95015,
      "N": 0.0,
      "V": 1350.0,
      "M": 6992.7982,
      "uy": -1.72220442,
      "rz": -3.4078869999999997
    },
    {
      "x": 0.9808,
      "N": 0.0,
      "V": 1350.0,
      "M": 6951.4204,
      "uy": -1.8078482399999998,
      "rz": -3.5124639999999996
    },
    {
      "x": 1.01145,
      "N": 0.0,
      "V": 1350.0,
      "M": 6910.042600000001,
      "uy": -1.8934920599999996,
      "rz": -3.6170409999999995
    },
    {
      "x": 1.0421,
      "N": 0.0,
      "V": 1350.0,
      "M": 6868.6652,
      "uy": -2.0130543999999997,
      "rz": -3.714978
    },
    {
      "x": 1.0727499999999999,
      "N": 0.0,
      "V": 1350.0,
      "M": 6827.2880000000005,
      "uy": -2.1495759999999993,
      "rz": -3.8095949999999994
    },
    {
      "x": 1.1034,
      "N": 0.0,
      "V": 1350.0,
      "M": 6785.910800000001,
      "uy": -2.2860975999999993,
      "rz": -3.9042119999999993
    },
    {
      "x": 1.13405,
      "N": 0.0,
      "V": 1350.0,
      "M": 6744.5336,
      "uy": -2.4226191999999998,
      "rz": -3.9988289999999997
    },
    {
      "x": 1.1647,
      "N": 0.0,
      "V": 1350.0,
      "M": 6703.1564,
      "uy": -2.5591407999999998,
      "rz": -4.093446
    },
    {
      "x": 1.19535,
      "N": 0.0,
      "V": 1350.0,
      "M": 6661.7792,
      "uy": -2.695662399999999,
      "rz": -4.188063
    },
    {
      "x": 1.226,
      "N": 0.0,
      "V": 1350.0,
      "M": 6620.402,
      "uy": -2.8321839999999994,
      "rz": -4.28268
    },
    {
      "x": 1.2566499999999998,
      "N": 0.0,
      "V": 1350.0,
      "M": 6579.0248,
      "uy": -2.968705599999999,
      "rz": -4.3772969999999995
    },
    {
      "x": 1.2872999999999999,
      "N": 0.0,
      "V": 1350.0,
      "M": 6537.6476,
      "uy": -3.105227199999999,
      "rz": -4.471914
    },
    {
      "x": 1.31795,
      "N": 0.0,
      "V": 1350.0,
      "M": 6496.2704,
      "uy": -3.241748799999999,
      "rz": -4.5665309999999995
    },
    {
      "x": 1.3485999999999998,
      "N": 0.0,
      "V": 1350.0,
      "M": 6454.8932,
      "uy": -3.3782703999999986,
      "rz": -4.661147999999999
    },
    {
      "x": 1.37925,
      "N": 0.0,
      "V": 1350.0,
      "M": 6413.5160000000005,
      "uy": -3.514792,
      "rz": -4.755765
    },
    {
      "x": 1.4099000000000002,
      "N": 0.0,
      "V": 1350.0,
      "M": 6372.1388,
      "uy": -3.6513136,
      "rz": -4.850382000000001
    },
    {
      "x": 1.44055,
      "N": 0.0,
      "V": 1350.0,
      "M": 6330.761600000001,
      "uy": -3.787835199999999,
      "rz": -4.944998999999999
    },
    {
      "x": 1.4712,
      "N": 0.0,
      "V": 1350.0,
      "M": 6289.3844,
      "uy": -3.9243567999999995,
      "rz": -5.0396160000000005
    },
    {
      "x": 1.5018500000000001,
      "N": 0.0,
      "V": 1350.0,
      "M": 6248.0072,
      "uy": -4.0608784,
      "rz": -5.134233
    },
    {
      "x": 1.5325,
      "N": 0.0,
      "V": 1350.0,
      "M": 6206.63,
      "uy": -4.197399999999999,
      "rz": -5.2288499999999996
    },
    {
      "x": 1.56315,
      "N": 0.0,
      "V": 1350.0,
      "M": 6165.2522,
      "uy": -4.379711199999999,
      "rz": -5.3135076
    },
    {
      "x": 1.5937999999999999,
      "N": 0.0,
      "V": 1350.0,
      "M": 6123.874400000001,
      "uy": -4.562022399999998,
      "rz": -5.398165199999999
    },
    {
      "x": 1.62445,
      "N": 0.0,
      "V": 1350.0,
      "M": 6082.4966,
      "uy": -4.744333599999999,
      "rz": -5.482822799999999
    },
    {
      "x": 1.6551,
      "N": 0.0,
      "V": 1350.0,
      "M": 6041.1188,
      "uy": -4.926644799999999,
      "rz": -5.5674804
    },
    {
      "x": 1.6857499999999999,
      "N": 0.0,
      "V": 1350.0,
      "M": 5999.741000000001,
      "uy": -5.108955999999998,
      "rz": -5.652137999999999
    },
    {
      "x": 1.7164,
      "N": 0.0,
      "V": 1350.0,
      "M": 5958.363200000001,
      "uy": -5.291267199999998,
      "rz": -5.7367956
    },
    {
      "x": 1.7470499999999998,
      "N": 0.0,
      "V": 1350.0,
      "M": 5916.9854000000005,
      "uy": -5.473578399999997,
      "rz": -5.821453199999999
    },
    {
      "x": 1.7777,
      "N": 0.0,
      "V": 1350.0,